{
  "auto": false,
  "branch_deleted": true,
  "changed": 0,
  "checks": [
    {
      "blocks": false,
      "name": "checks",
      "state": "passed"
    },
    {
      "blocks": false,
      "name": "review",
      "state": "approved"
    },
    {
      "blocks": false,
      "name": "behind_base",
      "state": "up_to_date"
    },
    {
      "blocks": false,
      "name": "conflicts",
      "state": "none"
    },
    {
      "blocks": false,
      "name": "github",
      "state": "clear"
    },
    {
      "blocks": false,
      "name": "local_changes",
      "state": "none"
    },
    {
      "blocks": false,
      "name": "unpushed_commits",
      "state": "none"
    }
  ],
  "default_method": "squash",
  "dry_run": false,
  "merge_later": false,
  "merge_queue": false,
  "merged": true,
  "method": "rebase",
  "methods": [
    "squash",
    "rebase"
  ],
  "pr": {
    "approvals": 1,
    "base": "main",
    "behind_base": 0,
    "checks": {
      "failed": 0,
      "passed": 1,
      "required": 1,
      "required_passed": 1,
      "running": 0,
      "state": "SUCCESS",
      "total": 1,
      "waiting": 0
    },
    "comments": 0,
    "commits": 9,
    "draft": false,
    "failed_checks": [],
    "head": "link-labels",
    "head_oid": "2222222222222222222222222222222222222222",
    "in_merge_queue": false,
    "merge_state": "CLEAN",
    "mergeable": "MERGEABLE",
    "number": 22,
    "queue_position": 0,
    "review_decision": "APPROVED",
    "state": "OPEN",
    "title": "Link labels",
    "url": "https://github.com/example/widgets/pull/22"
  },
  "ready": true,
  "remote_branch_deleted": true,
  "stage": "ready_to_merge",
  "unpushed": 0,
  "worktree": {
    "base": "origin/main",
    "branch": "link-labels",
    "created_at": "2026-01-01T00:00:00Z",
    "id": "wtreaaaaao",
    "name": "link-labels",
    "path": "/tmp/loam-contract/loamhome/worktrees/plotaaaaab/web-link-labels",
    "plot_id": "plotaaaaab",
    "repo": "/tmp/loam-contract/repos/web",
    "setup_done": false
  },
  "worktree_removed": true
}
